{
  "schema": "bocg.task-concepts/v1",
  "contract_version": "1.0.0",
  "identity_rule": "SHA-256 of exact kind, division key and concept label, first 24 hex characters; concepts never cross a division",
  "institution_instances": false,
  "sources": [
    {
      "path": "reference/operating-catalogue.v1.json",
      "sha256": "0acb2492f97f80c18f62f47b45427ba7d6912305104d6335f86531c88299e007"
    },
    {
      "path": "reference/task-concept-rulings.yaml",
      "sha256": "937be301f5750aa161ce5d5dde7a33ccd27f380e2a45b57904192f8bf80e309a"
    }
  ],
  "method": {
    "machine": {
      "algorithm": "average-linkage agglomerative clustering over Jaccard similarity of canonical label tokens",
      "similarity_threshold": 0.4,
      "token_rule": "bocg.canon.canon_name, digits dropped, verb/noun variants folded, stoplist removed",
      "stoplist_sha256": "555e9d69b3b2e505f562a38819e2a39c02e7a5a3af3d203f88d3eb7edf9d677f",
      "variants_sha256": "8f3988e31e93e3058c818e3890f3b1437b855bb0817dd4c28c7018727e030833",
      "representative_rule": "shortest member label, ties alphabetical; never an invented label",
      "read_by_a_human": false
    },
    "reviewed": {
      "rulings_path": "reference/task-concept-rulings.yaml",
      "rule": "only argued merges group definitions; everything the ruling does not merge stands alone"
    }
  },
  "divisions": [
    {
      "division_key": "buyside_portfolio_management",
      "review_status": "AUTO",
      "basis": "machine_clustered",
      "ruling": null,
      "counts": {
        "functions": 4,
        "function_concepts": 2,
        "tasks": 12,
        "task_concepts": 8,
        "aliases": 6
      }
    },
    {
      "division_key": "buyside_trading_execution",
      "review_status": "AUTO",
      "basis": "machine_clustered",
      "ruling": null,
      "counts": {
        "functions": 1,
        "function_concepts": 1,
        "tasks": 4,
        "task_concepts": 4,
        "aliases": 0
      }
    },
    {
      "division_key": "clearing_settlement_custody",
      "review_status": "AUTO",
      "basis": "machine_clustered",
      "ruling": null,
      "counts": {
        "functions": 1,
        "function_concepts": 1,
        "tasks": 3,
        "task_concepts": 3,
        "aliases": 0
      }
    },
    {
      "division_key": "commodities_trading",
      "review_status": "AUTO",
      "basis": "machine_clustered",
      "ruling": null,
      "counts": {
        "functions": 6,
        "function_concepts": 3,
        "tasks": 18,
        "task_concepts": 13,
        "aliases": 8
      }
    },
    {
      "division_key": "credit_trading",
      "review_status": "AUTO",
      "basis": "machine_clustered",
      "ruling": null,
      "counts": {
        "functions": 6,
        "function_concepts": 3,
        "tasks": 20,
        "task_concepts": 14,
        "aliases": 9
      }
    },
    {
      "division_key": "dcm_origination",
      "review_status": "AUTO",
      "basis": "machine_clustered",
      "ruling": null,
      "counts": {
        "functions": 1,
        "function_concepts": 1,
        "tasks": 3,
        "task_concepts": 3,
        "aliases": 0
      }
    },
    {
      "division_key": "ecm_origination",
      "review_status": "AUTO",
      "basis": "machine_clustered",
      "ruling": null,
      "counts": {
        "functions": 1,
        "function_concepts": 1,
        "tasks": 3,
        "task_concepts": 3,
        "aliases": 0
      }
    },
    {
      "division_key": "em_trading",
      "review_status": "AUTO",
      "basis": "machine_clustered",
      "ruling": null,
      "counts": {
        "functions": 2,
        "function_concepts": 2,
        "tasks": 8,
        "task_concepts": 8,
        "aliases": 0
      }
    },
    {
      "division_key": "equities_trading",
      "review_status": "AUTO",
      "basis": "machine_clustered",
      "ruling": null,
      "counts": {
        "functions": 5,
        "function_concepts": 3,
        "tasks": 17,
        "task_concepts": 10,
        "aliases": 9
      }
    },
    {
      "division_key": "equity_derivatives_structured",
      "review_status": "AUTO",
      "basis": "machine_clustered",
      "ruling": null,
      "counts": {
        "functions": 4,
        "function_concepts": 2,
        "tasks": 14,
        "task_concepts": 10,
        "aliases": 6
      }
    },
    {
      "division_key": "fx_cross_asset_combined",
      "review_status": "AUTO",
      "basis": "machine_clustered",
      "ruling": null,
      "counts": {
        "functions": 1,
        "function_concepts": 1,
        "tasks": 3,
        "task_concepts": 3,
        "aliases": 0
      }
    },
    {
      "division_key": "fx_trading",
      "review_status": "AUTO",
      "basis": "machine_clustered",
      "ruling": null,
      "counts": {
        "functions": 4,
        "function_concepts": 3,
        "tasks": 14,
        "task_concepts": 12,
        "aliases": 3
      }
    },
    {
      "division_key": "global_banking_financing",
      "review_status": "AUTO",
      "basis": "machine_clustered",
      "ruling": null,
      "counts": {
        "functions": 1,
        "function_concepts": 1,
        "tasks": 3,
        "task_concepts": 3,
        "aliases": 0
      }
    },
    {
      "division_key": "global_financing_capital_markets",
      "review_status": "AUTO",
      "basis": "machine_clustered",
      "ruling": null,
      "counts": {
        "functions": 1,
        "function_concepts": 1,
        "tasks": 3,
        "task_concepts": 3,
        "aliases": 0
      }
    },
    {
      "division_key": "leveraged_finance_loan_capital_markets",
      "review_status": "AUTO",
      "basis": "machine_clustered",
      "ruling": null,
      "counts": {
        "functions": 1,
        "function_concepts": 1,
        "tasks": 3,
        "task_concepts": 3,
        "aliases": 0
      }
    },
    {
      "division_key": "listed_derivatives_client_clearing",
      "review_status": "AUTO",
      "basis": "machine_clustered",
      "ruling": null,
      "counts": {
        "functions": 2,
        "function_concepts": 2,
        "tasks": 8,
        "task_concepts": 7,
        "aliases": 1
      }
    },
    {
      "division_key": "market_risk_management",
      "review_status": "AUTO",
      "basis": "machine_clustered",
      "ruling": null,
      "counts": {
        "functions": 3,
        "function_concepts": 3,
        "tasks": 7,
        "task_concepts": 5,
        "aliases": 2
      }
    },
    {
      "division_key": "prime_brokerage_financing",
      "review_status": "AUTO",
      "basis": "machine_clustered",
      "ruling": null,
      "counts": {
        "functions": 6,
        "function_concepts": 4,
        "tasks": 20,
        "task_concepts": 16,
        "aliases": 6
      }
    },
    {
      "division_key": "rates_fx_combined",
      "review_status": "AUTO",
      "basis": "machine_clustered",
      "ruling": null,
      "counts": {
        "functions": 1,
        "function_concepts": 1,
        "tasks": 3,
        "task_concepts": 3,
        "aliases": 0
      }
    },
    {
      "division_key": "rates_trading",
      "review_status": "AUTO",
      "basis": "machine_clustered",
      "ruling": null,
      "counts": {
        "functions": 5,
        "function_concepts": 3,
        "tasks": 16,
        "task_concepts": 14,
        "aliases": 4
      }
    },
    {
      "division_key": "regulatory_reporting_conduct_compliance",
      "review_status": "AUTO",
      "basis": "machine_clustered",
      "ruling": null,
      "counts": {
        "functions": 1,
        "function_concepts": 1,
        "tasks": 3,
        "task_concepts": 3,
        "aliases": 0
      }
    },
    {
      "division_key": "repo_secfin_collateral",
      "review_status": "AUTO",
      "basis": "machine_clustered",
      "ruling": null,
      "counts": {
        "functions": 3,
        "function_concepts": 2,
        "tasks": 11,
        "task_concepts": 10,
        "aliases": 2
      }
    },
    {
      "division_key": "securitised_products",
      "review_status": "AUTO",
      "basis": "machine_clustered",
      "ruling": null,
      "counts": {
        "functions": 6,
        "function_concepts": 4,
        "tasks": 20,
        "task_concepts": 16,
        "aliases": 6
      }
    },
    {
      "division_key": "sellside_research",
      "review_status": "AUTO",
      "basis": "machine_clustered",
      "ruling": null,
      "counts": {
        "functions": 1,
        "function_concepts": 1,
        "tasks": 3,
        "task_concepts": 3,
        "aliases": 0
      }
    },
    {
      "division_key": "trade_lifecycle_operations",
      "review_status": "AUTO",
      "basis": "machine_clustered",
      "ruling": null,
      "counts": {
        "functions": 1,
        "function_concepts": 1,
        "tasks": 3,
        "task_concepts": 3,
        "aliases": 0
      }
    }
  ],
  "concepts": [
    {
      "concept_id": "function_concept:buyside_portfolio_management:990b322837ff07aa9efe3de7",
      "kind": "function_concept",
      "division_key": "buyside_portfolio_management",
      "label": "Buy-side portfolio managers",
      "label_source": "member",
      "review_status": "AUTO",
      "basis": "machine_clustered",
      "rationale": null,
      "members": [
        "function:buyside_portfolio_management:ed9d57995a187801408bd657",
        "function:buyside_portfolio_management:9c476d904622645dc555c944"
      ],
      "member_labels": [
        "Asset management portfolio managers and buy-side traders",
        "Buy-side portfolio managers"
      ],
      "aliases": [
        {
          "reference_id": "function:buyside_portfolio_management:ed9d57995a187801408bd657",
          "label": "Asset management portfolio managers and buy-side traders",
          "rationale": "machine-clustered: mean Jaccard 0.57 to the other members; unread by any human"
        }
      ],